query,id,title,selftext,score,num_comments,created_utc,created_date,url,permalink
lit review ai,1qx4dax,What is the best AI tool that you use for research?,"I am working on something and would love to know what tools the community has been using AI for lit review, brainstorming, paper writing etc.",0,6,1770342222,2026-02-06 01:43:42,https://www.reddit.com/r/academia/comments/1qx4dax/what_is_the_best_ai_tool_that_you_use_for_research/,https://www.reddit.com/r/academia/comments/1qx4dax/what_is_the_best_ai_tool_that_you_use_for_research/
ai literature review,1qyfu1f,Why is my AI detection so high on my literature review when TurnItIn is 4 percent?,"Sorry I’m panicking but my literature review of 13 articles, came back with a similarity of 4 percent on TurnItIn (basically two or three direct quotes). I submitted it a few days ago but I checked an AI detector purely out of curiosity and it’s basically saying parts of my literature review are as high as 55 percent. My issue is, my first draft of my thematic discussion, my supervisor told me to add more study depth, like what was the aim of them, description of participants, data collection and analysis that type of thing. This caused me to have to paraphrase a lot to keep within word count and I have a feeling that’s why it’s so high. Would someone be able to put my mind at ease because other than using Grammarly to spell check, help me check words to hyphenate (to get within word count), with it once or twice telling me to change “the study…” to “this study”, I didn’t use AI. ",0,8,1770476145,2026-02-07 14:55:45,https://www.reddit.com/r/academia/comments/1qyfu1f/why_is_my_ai_detection_so_high_on_my_literature/,https://www.reddit.com/r/academia/comments/1qyfu1f/why_is_my_ai_detection_so_high_on_my_literature/
ai literature review,1r5f528,My paper is being flagged off by turnitin to have 100% AI Plagiarism.,"Hello

So I am conducting a research and my professor asked me to write him an overview about the research to start working on it.

  
I dumbed all my ideas on my notes and since I had no time to do the punctuation marks thing, I gave it to ChatGPT to only correct writing errors spelling and add appropriate punctuation marks.

  
I was astonished when my professor told me that when he used Turnitin, it turned out to be written by AI and I talked with him out and he told me that it is due to AI print.

  
I can't not use AI in my paper at all. I mean is that even possible?

  
I am now in the process of reading literature and I was taking notes like:

**Paper Title:**  
**Authors:**  
**Year:**  
**Conference or Journal:**

**Objectives:**  
What were they trying to solve?

**Methodology:**  
Human evaluation? Automatic metrics? Dataset size?

**Key Findings:**  
What worked or failed?

**Limitations or Gaps:**  
What did they miss that *I* can address?

**Relevance to My Research:**  
One paragraph. My perspective.

  
And ngl I used AI a little bit cuz I've been doing heavy readings cuz I couldn't copy paste certain sentences so I had to ask ChatGPT or Perplexity to paraphrase when I couldn't understand certain things and sometimes, I'd take the output as is where at other times I'd write it on my own.

  
The problem is, GPTZero keeps giving me AI detection yet it keeps changing when I am writing.

  
I'm worried my professor would know I used AI. The Literature Review is for me yet he asked me for a Doc where I'd add all the papers and summaries about them yet what I am actually doing is following that template.

  
I am writing posts and I usually write down my thought or write posts yet when it comes to academic writing and following a certain pattern, I don't feel like doing it for you need to use certain things and vocab. 

  
Am I cooked for using AI like this?

  
My professor is being a bit strict cuz he is willing to help me get my paper published once I am done.

  
It is impossible to have 100% AI! maybe 20% I feel lost and hopeless ",0,4,1771163529,2026-02-15 13:52:09,https://www.reddit.com/r/academia/comments/1r5f528/my_paper_is_being_flagged_off_by_turnitin_to_have/,https://www.reddit.com/r/academia/comments/1r5f528/my_paper_is_being_flagged_off_by_turnitin_to_have/
ai literature review,1rczqtc,Making a literature review publicly available without peer-review/publishing?,"Hello. I'll preface this by saying: I'm not in academia, and I'm no longer pursuing a career in academia. And I hope this isn't a stupid question but I didn't find any similar posts. 

I'm a bioinformatics major and was doing dry-lab work for a research lab at my university. It was only for ab 3 months with no pay, and probably contributed very little to the actual lab lol, but I enjoyed the experience.

When I was first starting, the professor that was running the lab asked me to write him a literature review. He gave me two journal articles that he co-authored about the ongoing research, along with a third separate article which outlined an AI framework that could be helpful to emulate for his own lab. Anyways, I wrote the lit review and I'm honestly really proud of it. I thoroughly enjoyed writing it and I put a lot of time/effort into this 7-page doc. Everything is cited correctly, all references are stated in a bibliography, and it looks pretty good IMHO. Here's my problem:

I am currently looking to pivot into the legal field, and **this lit review would really showcase my technical writing capabilities but I'm unsure of how to leverage it**.

I don't plan to get it peer-reviewed, but I would like to place it on LinkedIn or my resume. I've thought about attaching the PDF as media on a project under my LinkedIn account, but the PDF doesn't sit well on the site and I'm unsure about possible licensing mishaps. Since I don't plan to get published in the future, would it be beneficial for me to submit this lit review as a Preprint (biorxiv, preprints.org)? Is there any online platform where I could post this lit review, and other technical scientific writing, without worrying about peer-review? Something like substack or medium? Any/all advice is appreciated.",2,8,1771894048,2026-02-24 00:47:28,https://www.reddit.com/r/academia/comments/1rczqtc/making_a_literature_review_publicly_available/,https://www.reddit.com/r/academia/comments/1rczqtc/making_a_literature_review_publicly_available/
ai literature review,1s46w0y,At what point does AI stop helping and start making literature review harder to manage?,"I’ve been thinking about this a lot lately.

For simple research tasks, AI is obviously useful. But once a literature review starts branching into multiple themes, arguments, and source clusters, I’m not always sure the default workflow still helps. At that point, the real challenge isn’t just getting answers — it’s keeping the structure of the project clear enough to think and write.

I’m building in this space, so I may be biased, but I’m genuinely trying to understand the real failure point.

The direction I’ve been exploring is a workflow where deeper questions can branch into connected pages, the overall structure stays visible in a visual canvas/map, and long-form research is read more like a report/book than one endless linear thread.

For people here doing serious academic work:  
**what becomes hardest first once a literature review gets large — keeping claims tied to sources, keeping themes separate, or turning all of it into a coherent draft?**",0,5,1774530263,2026-03-26 13:04:23,https://www.reddit.com/r/academia/comments/1s46w0y/at_what_point_does_ai_stop_helping_and_start/,https://www.reddit.com/r/academia/comments/1s46w0y/at_what_point_does_ai_stop_helping_and_start/
llm literature review,1s6pw26,"I'm a bit tired of getting AI-generated papers emailed to me, so I broke one down to explain why they don't work.","As many of you know, as academics we are pretty constantly bombarded by emails from people effectively saying, ""AI helped me write this paper about my huge discovery, can you endorse it for arXiv/tell me what you think?"" I usually ignore these--the vast majority are wild grandiose claims that a glance are unlikely to be meaningful. However, this week I received an astrophysics paper from a viewer that did not seem ridiculous. In fact, at first glance, it seemed quite reasonable, made a restrained, testable claim about a reasonable observation, and didn't have any super obvious red flags besides the usual LLM deficiencies (bad at citations, etc.). I decided to give this one a shot and proposed a challenge to the viewer: I'd review the paper on camera, and if it was good, I'd endorse him for arXiv. If not, I'd explain how the paper could be improved. 

A very fair reaction you might be having now is, ""this is a waste of time!"" Certainly, I can't do this for every paper I get, nor do I want to fill my time reading AI slop. However, I think there's a valuable exercise here, one where a little effort can go a long way, and perhaps reach some people that really need to hear this. Despite a few comments which criticized the original video for deconstructing an argument they felt nobody was making (effectively, ""nobody actually thinks these things can do science!"") vixra submissions and my own email inbox would suggest otherwise. My intent for this discussion is to help crystallize the issues with LLM-driven science by taking one of the best attempts I've seen yet and showing problems that are common to this method. Hopefully, I can point future emailers to this video in the future, so that they can re-assess their own work without me needing to break down every LLM paper I receive.

I break down the paper in the video (including the science behind the claim), but the key issues are this:

1. Lots of inaccuracies. There are many wrong statements in the paper. The primary formula that the key result revolves around is a possibly incorrect simplification of a significantly more complex calculation, which is not addressed anywhere in the result. At worst, the methodology of the paper is incorrect; at best it is unjustified.
2. The paper is completely underwritten (a common LLM-driven paper problem). There's zero literature review (more on this later). Choices in methods and figures are left completely unjustified. The paper analyzes a sample of 175 galaxies but only includes 10 in the analysis without explaining why or how the selection was made. There is no quantitative discussion or attempts to compare with past results. The primary result is hand-wavingly stated without deeper exploration or motivation. 
3. The primary result is simply uninteresting, bordering on tautological. The study takes a statistical correlation that has been very well-established on many galaxies in a sample, then looks at a few of the galaxies in the sample and find that the statistical correlation holds if you look at each galaxy individually. This is very obviously true and not a discovery at all, but it is presented like it is completely novel. The analogy I draw is: imagine it is well known that tall people tend to weigh more. Then a new paper comes along and measures someone's weight once a year, and finds that as they get taller they weigh more, and then claim it as a new discovery. 
4. There is complete disengagement with the literature. As I mentioned earlier, there are basically no citations in the paper. This is a problem from an ethical and procedural perspective, and it makes it impossible to verify where certain statements are coming from. But the lack of literature review is very problematic for another reason: as I was catching up on the literature of this field to review the paper, I immediately came across several other papers that did exactly what this paper is claiming to do, but better and in a more interesting way. See for example, Li et al. (2018), published in A&A, called ""Fitting the Radial Acceleration Relation to Individual SPARC Galaxies"". Or Lelli et al. (2017), which literally made a [movie](https://astroweb.cwru.edu/SPARC/Video.html) showing how each individual SPARC galaxy adds to the RAR. The LLM paper's Figure 1 is essentially a static version of this animation, presented as a novel finding. 

I go into this in more detail in the video, but this is the gist. I also present general advice to the viewer on how they can have more success doing a science project such as this. But the paper worried me significantly. LLM capabilities have not improved at all in terms of producing meaningful science in the last year or two, but their ability to produce *meaningless* science that *looks* meaningful has wildly improved. I am concerned that this will present serious problems for the future of science as it becomes impossible to find the actual science in a sea of AI slop being submitted to journals. 

LLMs are painted as democratizing science, but I'm actually worried that soon journals won't even allow you to submit unless you have senior faculty at a major institution vouching for you because they can't compete with the tide of garbage that will be expedient to produce and submit at scale. If you were a journal, trying to maintain a standard of quality, while also making sure that the good papers get through, how would you do this without an army of reviewers working around the clock? I seriously worry that this will lead to academia becoming more closed, not less.

I'd love to hear your thoughts on this discussion! Thanks so much for taking the time to read this.",23,8,1774773840,2026-03-29 08:44:00,https://www.youtube.com/watch?v=Z_NlvCCgVt4,https://www.reddit.com/r/academia/comments/1s6pw26/im_a_bit_tired_of_getting_aigenerated_papers/
ai literature review,1s8lfzx,Advice on how to correct my literature review after receiving two completely different feedbacks,"So I finished writing my lit review for my 3rd of Bsc (I need to hand it in this week) in an English-speaking country. The feedback I got about my draft from my supervisor was very minimal, so I thought that's a good sign. But then I asked my sister (she's pursuing a doctorate) to have a look and she pointed out a lot of stuff. Now my dilemma is that neither me or my sister are native English speakers (in the sense I'm worried about grammar mistakes) and she's in a different field than me. I trust her judgment but because I had completely different feedback from my supervisor I'm not sure what to believe.

Long story short, does anyone know of a non-AI tool/software or method I could use to correct my lit review? I am not sure what is the best way moving forward to make sure my lit review is up to snuff. Any advice at all would be welcome :)",0,2,1774958508,2026-03-31 12:01:48,https://www.reddit.com/r/academia/comments/1s8lfzx/advice_on_how_to_correct_my_literature_review/,https://www.reddit.com/r/academia/comments/1s8lfzx/advice_on_how_to_correct_my_literature_review/
ai literature review,1sq6llk,These AI prompts have cut my research workflow in half — sharing my system,"Not here to debate whether AI belongs in academia — it's already here. The question is whether you're using it well or wasting time with bad prompts that produce garbage.

After months of iteration, here's my actual workflow for a literature review:

Step 1 — Source Summarization After reading each paper, I feed the key findings into this prompt: *""Summarize this research finding in 3 sentences: the methodology used, the key result, and the primary limitation. Then rate its relevance to \[your topic\] on a scale of 1-5 with justification.""*

Step 2 — Synthesis Across Sources Once I have 8-10 summaries: *""Here are summaries from \[X\] papers on \[topic\]: \[paste summaries\]. Synthesize these into a coherent narrative that: groups findings by theme, highlights areas of consensus, identifies contradictions, and suggests where the literature is heading.""*

Step 3 — Gap Analysis *""Based on this synthesized literature review, identify 3-5 specific gaps that could form the basis of new research. For each gap, explain: why it matters, what methodology could address it, and what the expected contribution would be.""*

The key insight: AI is terrible at replacing your thinking but excellent at structuring it. These prompts don't write your paper — they force a framework that makes your own analysis sharper.

I've built similar prompt chains for paper writing, data interpretation, thesis argumentation, and exam prep. I have a couple prompts in my bio, let me know if you want to see any of those.",0,3,1776636265,2026-04-19 22:04:25,https://www.reddit.com/r/academia/comments/1sq6llk/these_ai_prompts_have_cut_my_research_workflow_in/,https://www.reddit.com/r/academia/comments/1sq6llk/these_ai_prompts_have_cut_my_research_workflow_in/
ai literature review,1t6il5y,you are lucky if your PhD supervisor likes you,"i spent past three months writing my literature review and had a meeting with my supervisor today...she literally y said that my review lacks depth. DEPTH. I just sat there listening to her feeling and feeling sad.

After coming home I started to vent to my friends that doing a research feels impossible now and the conversation turned into this weird research ai support group. it's funny how everyone has their own way for surviving the dissertation.

Like one of my friend is obsessed with perplexity for broad stuff, though we all agreed it answers with the terrifying confidence of someone who definitely hasn't read the full paper.

I told them how I dislike switching between 30 tabs and make notes, then someone suggested me Scira, the new update actually surprised me a little. being able to choose sources and watch the steps while it's working makes it feel less like blindly trusting a chatbot

after that i used scite and immediately discovered one paper one paper i was heavily relying on was getting destroyed by later citations genuinely sat there staring at my screen in disbelief.

We all agree that consensus has become a shortcut for when we physically cannot look at another 30-page pdf, and scispace is for those days when the academic jargon feels like a side quest we didn't sign up for.

overall i still think actual understanding matters way more than tools. but atleast now the mo suffering is slightly more organised

I still haven't figured out how to make my supervisor like me, i think that's one thi Al can't do..meeting her next tuesday. keep me in your prayers please.",0,19,1778177488,2026-05-07 18:11:28,https://www.reddit.com/r/academia/comments/1t6il5y/you_are_lucky_if_your_phd_supervisor_likes_you/,https://www.reddit.com/r/academia/comments/1t6il5y/you_are_lucky_if_your_phd_supervisor_likes_you/
llm literature review,1tc0cy4,I stopped trying to detect AI writing. Now I require an audit trail.,"read a first year grad students lit review draft this week, and honestly, i wasnt mad, i was just worried.  
at first glance it looked totally fine. smooth writing, citations in the right places, that polished academic tone we are all getting used to seeing. but a few pages in, it started to feel empty.  
the topic was chemistry, so the details really mattered: mechanisms, reaction conditions, catalyst systems, control experiments, and which evidence supports which claim. the draft kept saying things like one paper showed improved performance or another gave mechanistic insight, but when i asked what the actual mechanism was, or which experiment backed up the claim, the student couldnt really explain it.  
and that was the real problem.  
not the fact that ai may have been used. i am not trying to ban ai in my lab; i actually think it can be useful for finding papers, organizing sources, comparing studies, pulling out experimental conditions, and spotting connections across a messy literature.  
the problem is when the step between reading and writing disappears.  
a literature review shouldnt just be a smooth paragraph generator. especially in chemistry, the work is not just find papers and summarize them. it is understanding why a result happened, whether the evidence actually supports the authors interpretation, and how one claim connects to another.  
so i changed my labs ai policy.  
i told the group that i am not interested in playing detective and trying to decide whether a paragraph was ai generated. that feels like a losing game. what i care about is whether the research process can be traced.  
the new rule is pretty simple: if ai is used during the literature review process, the student needs to be able to show the path from search to source to claim.  
zotero is still required for reference management. for data analysis, no black box ai stats tools. use r, python, stata, or whatever else u actually understand, but u need to know what the code is doing.  
i dont mind ai tools for literature discovery. honestly, i want students exploring citation networks, following related papers, and seeing where different interpretations disagree. litmaps is useful for getting the big picture. i have also been testing sciclaw lately bc i like the idea of an ai assisted literature workflow that leaves a trail: what was searched, which papers came up, what was extracted, and where each claim came from.  
but the specific tool matters less than the principle. if i ask where did this sentence come from, the answer cant be a blank stare.  
for writing, i am also asking students to write the first draft themselves, not generate the whole thing with an llm. i am completely fine with the reverse workflow: write your own draft first, then use ai to critique it. something like, act as a skeptical chemistry professor and challenge the mechanistic claims in this review, is actually a great use of ai. that kind of prompt sharpens thinking instead of replacing it.  
maybe this sounds strict, but i am becoming more convinced that research group ai policies should focus less on detection and more on traceability.  
the issue isnt whether students use ai.  
the issue is whether they can reconstruct how they got from a paper to a claim.  
i am honestly happy to see my students using ai, but i also lowkey worry about them getting lazy in their learning and their thinking. i hope this new setup actually works. let me know if u guys have any other good ideas for this.",6,10,1778680437,2026-05-13 13:53:57,https://www.reddit.com/r/academia/comments/1tc0cy4/i_stopped_trying_to_detect_ai_writing_now_i/,https://www.reddit.com/r/academia/comments/1tc0cy4/i_stopped_trying_to_detect_ai_writing_now_i/
ai literature review,1tpj4oz,AI PhD Advisor: the answer to an age old problem?,"Assuming you are working in theoretical subjects, isn't it possible to have an AI Agent that is taking up the role and tasks of a PhD advisor? Topic suggestions based on student's interests, literature suggestions (based on CROSSREF publications only), and theory discussions, these should all be possible with such an AI advisor. After all, it will unbiased, will not abuse power, and actually provide support whenever you need it, including research writing advice and journal selection/review feedback analysis. The AI advisor's knowledge coverage will also be vast compared to a random human advisor who your institution chose for you. 
Time to change the game? ",0,24,1779917030,2026-05-27 21:23:50,https://www.reddit.com/r/academia/comments/1tpj4oz/ai_phd_advisor_the_answer_to_an_age_old_problem/,https://www.reddit.com/r/academia/comments/1tpj4oz/ai_phd_advisor_the_answer_to_an_age_old_problem/
ai literature review,1tr6e4h,What kind of academic tools do you use for research?,"I’m a PhD student, and these are the tools I use for research.

To find academic papers: I use LitFlo (https://litflo.ai) to find  publications based on my topic and send them straight to my inbox.

Literature review: Notebook LM to dive deeper and analyze them.

Citation manager: I use End Note as a citation reference manager. 

 For publication quality figures: I use Biorender to create my figures. 

Does anyone use these too? Or do you have any other recommendations?

Always looking to improve my process. ",1,0,1780070468,2026-05-29 16:01:08,https://www.reddit.com/r/academia/comments/1tr6e4h/what_kind_of_academic_tools_do_you_use_for/,https://www.reddit.com/r/academia/comments/1tr6e4h/what_kind_of_academic_tools_do_you_use_for/
ai literature review,1tr6qeo,What are the top research tools you use?,"I’m a PhD student, and top tools I use are:

\- LitFlo: to find credible academic papers directly to my email inbox  
\- Notebook LM: to conduct an in-depth literature review only getting AI results directly from my paper. I also like to create podcast with these to listen to my way to school.  
\- End Note: citation manager, and it’s really helpful when you have a vast amount of citations  
\- Biorender: to create publication quality figures, and it’s really easy to use

Does anyone use these and/ or like them? What tools do you use? ",0,15,1780071121,2026-05-29 16:12:01,https://www.reddit.com/r/academia/comments/1tr6qeo/what_are_the_top_research_tools_you_use/,https://www.reddit.com/r/academia/comments/1tr6qeo/what_are_the_top_research_tools_you_use/
