query,id,title,selftext,score,num_comments,created_utc,created_date,url,permalink
ai literature review,1deef9z,How Researchers Stay Current with New Papers and Developments,"I wrote an article (based on survey with almost 40 respondents) on this specific topic! If you are interested please read:

# Introduction

In today's fast-paced world of scientific research, staying current with the latest developments and literature in one's field is paramount. Researchers who fail to keep abreast of new findings and advancements risk falling behind their peers, missing out on crucial insights, and potentially wasting time and resources on already-explored ideas. Staying up-to-date allows researchers to build upon existing knowledge, identify gaps in the current understanding, and develop innovative solutions to pressing problems.

However, the sheer volume of scientific literature published each year poses significant challenges for researchers trying to stay informed. With countless journals, preprints, and conference proceedings to sift through, it can be overwhelming and time-consuming to identify the most relevant and impactful papers. Furthermore, the increasing specialization of research fields means that important developments may be scattered across multiple disciplines, making it even more difficult for researchers to have a comprehensive overview of their area of study.

To better understand how researchers navigate these challenges, we surveyed participants about their strategies for staying current with the latest literature, their tools, and the obstacles. This article aims to synthesize the insights gained from these responses and provide an overview of the current landscape of scientific literature monitoring. By sharing the experiences and perspectives of researchers across various fields, we hope to foster a discussion on best practices and potential solutions to help researchers stay at the forefront of their disciplines.

# Common Tools and Techniques Used by Researchers

Staying up-to-date with the latest developments in one's field is crucial for researchers. To achieve this, they employ various tools and techniques that help them discover, filter, and organize relevant literature. Among the most popular tools are search engines like Google Scholar and Semantic Scholar, which allow researchers to search for papers using keywords, authors, or citations. These platforms provide access to a vast database of scholarly literature, making it easier for researchers to find relevant papers quickly.

Preprint servers, such as arXiv, have become increasingly popular in recent years. These platforms allow researchers to share their work before it undergoes peer review and publication in a journal. By monitoring preprint servers, researchers can stay informed about the latest findings in their field and engage in discussions with their peers.

Many researchers also rely on journal and conference alerts to stay updated. By subscribing to these alerts, they receive notifications when new papers are published in their areas of interest. This helps them save time by not manually searching for new publications.

Personalized recommendations, such as those provided by Google Scholar alerts, have also become a valuable tool for researchers. These alerts notify users when new papers that match their interests are published, ensuring they don't miss out on important developments in their field.

Social media and networking platforms have also become increasingly important for researchers. Twitter, for example, has become a popular platform for sharing and discussing new research findings. By following relevant hashtags and accounts, researchers can stay informed about the latest developments in their field and engage in discussions with their peers.

Finally, collaboration with colleagues remains a crucial aspect of staying up-to-date with new developments. By attending conferences, participating in journal clubs, and engaging in discussions with their peers, researchers can learn about new findings and ideas that may not be available through other channels.

# Challenges and Pain Points

Staying on top of the latest research developments is a critical task for researchers, academics, and professionals across various fields. However, this process is fraught with numerous challenges and pain points that can hinder their ability to effectively navigate the ever-expanding landscape of scientific literature. Based on the insights gathered from the survey responses, four key issues emerge as the most significant hurdles: information overload and noise, paywalls, and access to papers, time constraints, and keeping up with interdisciplinary research.

## Information Overload and Noise

One of the most prominent challenges highlighted by the respondents is the sheer volume of research papers published daily, leading to information overload. As one participant aptly put it, ""There is a lot of noise and least-publishable-units out there."" The rapid pace of publication across various fields makes it increasingly difficult for researchers to sift through the vast amount of available literature and identify the most relevant and high-quality papers in their areas of interest.

Several respondents expressed their frustration with the high noise levels in their searches, with one stating, ""The noise level was high."" This sentiment is echoed by another participant who wished for ""fewer rubbishy papers!"" The presence of low-quality or irrelevant papers clutters the research landscape, making it harder for researchers to find the most valuable and impactful studies.

To combat this issue, participants employ various strategies, such as relying on specific keywords, filtering by authors or publication venues, and utilizing tools like Google Scholar and arXiv. However, these methods are not always sufficient to cut through the noise effectively. As one respondent noted, ""It doesn't work very well even with specific keywords. I get better results when I search by author and then do further research based on analysis of bibliography of chosen article.""

## Paywalls and Access to Papers

Another significant pain point identified by the respondents is the presence of paywalls and limited access to research papers. Many participants expressed their desire for a more open and accessible research ecosystem, with one stating, ""My magic trick would be all papers and journals publicly available. I have no problem reading and learning things. My real problem is when paying is required to access science and tools.""

Paywalls pose a significant barrier for researchers, especially those affiliated with institutions that may not have subscriptions to all the relevant journals or databases. As one respondent shared, ""When I can't read a paper because is not open, most of the cases I am forced to read another source instead."" This limitation hinders researchers' ability to comprehensively review the literature and stay abreast of the latest developments in their fields.

Some participants rely on their institutional affiliations to access paywalled content, while others resort to alternative sources or settle for reading abstracts and open-access papers. However, these workarounds are not ideal and can lead to an incomplete understanding of the research landscape.

## Time Constraints

Time constraints emerge as another critical challenge for researchers trying to stay on top of the latest literature. With the fast-paced nature of research and the constant influx of new papers, finding the time to thoroughly review and digest the relevant studies can be a daunting task.

Participants reported spending anywhere from a few minutes to several hours per day or week on staying updated with new research. One respondent noted, ""Around 20% of my time is spent on that. However, this is also because I am a reviewer for many of these venues."" The time commitment required to stay current can be substantial, especially for those with multiple research interests or responsibilities.

To manage this challenge, some respondents have developed strategies such as setting aside dedicated time for reading papers, prioritizing based on relevance and quality, and relying on tools and alerts to streamline the process. However, the time investment remains a significant hurdle, with one participant stating, ""The most consuming part is to read and understand the paper. There are a lot of equations and prior knowledge required.""

## Keeping Up with Interdisciplinary Research

As research becomes increasingly interdisciplinary, staying informed about developments in adjacent fields and understanding their potential implications for one's work presents a unique challenge. Participants acknowledged the importance of keeping up with interdisciplinary research but also highlighted the difficulties in doing so effectively.

One respondent noted, ""Working with large ambiguities and uncertainties, and with a lack of previous developments and heritage, one must seek analogies in other fields and industries; recent as well as old papers."" This sentiment underscores the need for researchers to look beyond their immediate areas of expertise and explore connections with other disciplines.

However, identifying and understanding relevant research from other fields can be time-consuming and complex. Participants reported using various strategies, such as attending conferences, engaging in discussions with colleagues from different backgrounds, and using tools like Google Scholar and Semantic Scholar to discover interdisciplinary connections.

Despite these efforts, keeping up with interdisciplinary research remains a significant challenge. One respondent observed, ""It definitely was not the most efficient way to do this."" The lack of standardized keywords, differences in terminology, and the breadth of potentially relevant literature across disciplines can make it difficult for researchers to effectively navigate this landscape.

In conclusion, the challenges and pain points identified by the survey respondents highlight the complex nature of staying on top of the latest research developments. Information overload and noise, paywalls and access limitations, time constraints, and the difficulties of keeping up with interdisciplinary research all contribute to the obstacles faced by researchers in their quest to remain current and informed.

Addressing these challenges will require a multifaceted approach, including the development of more sophisticated tools for filtering and discovering relevant papers, the promotion of open access and the removal of paywalls, and the fostering of interdisciplinary collaboration and communication. By tackling these pain points head-on, the research community can work towards creating a more efficient, accessible, and effective system for staying on top of the latest developments in their fields.

# Desired Improvements and Wishlist

The survey responses reveal a strong desire among researchers for better tools and systems to help them stay on top of the latest developments in their fields. One of the most frequently mentioned improvements is the need for better categorization and filtering of papers. Researchers often find themselves overwhelmed by the sheer volume of new papers published each day, making it difficult to identify the most relevant and important studies. They express a wish for more accurate and specific filters that can help them narrow down their searches based on keywords, topics, or specific subfields. Some respondents even suggest the use of AI or machine learning algorithms to improve the relevance of search results and reduce the noise in the system.

Another common theme in the responses is the desire for personalized recommendations based on individual research interests. Many researchers would like to see a system that can learn from their reading habits and preferences, and suggest new papers that are likely to be of interest to them. This could be achieved through the use of collaborative filtering algorithms, similar to those used by online retailers and streaming services. By analyzing the reading patterns of similar users, the system could make intelligent recommendations and help researchers discover new and relevant papers that they might have otherwise missed.

In addition to personalized recommendations, many researchers also express a desire for summaries and digests of recent developments in their fields. With the rapid pace of scientific progress, it can be challenging to keep up with all the latest findings and breakthroughs. Researchers would appreciate a service that could provide them with concise summaries of the most important papers and developments, allowing them to quickly get up to speed on the latest research without having to read through dozens of individual papers. Some respondents even suggest the use of natural language processing techniques to automatically generate these summaries, saving researchers valuable time and effort.

Another major pain point for researchers is the issue of access to scientific literature. Many respondents express frustration with the current system of paywalls and subscription fees, which can make it difficult or impossible to access important papers and studies. They would like to see a move towards open-access publishing, where all scientific literature is freely available to anyone who wants to read it. This would not only benefit individual researchers but also help to accelerate scientific progress by making it easier for researchers to build on each other's work and collaborate across institutions and disciplines.

Finally, many researchers express a desire for better tools for managing and organizing the papers they read. With the vast amount of literature available, it can be challenging to keep track of all the papers that are relevant to one's research. Respondents mention using a variety of tools, such as reference management software like Zotero and Mendeley, but they would like to see more advanced features and integrations. For example, some researchers suggest the ability to automatically extract key information from papers, such as the main findings and methodologies, and store this information in a structured database for easy retrieval later on. Others would like to see better collaboration features, such as the ability to share and discuss papers with colleagues in real time.

The survey responses reveal a clear need for better tools and systems to help researchers stay on top of the latest developments in their fields. From improved categorization and filtering of papers to personalized recommendations and summaries, to open-access publishing and better management tools, there are many areas where researchers would like to see improvements. By addressing these pain points and wishlist items, we can help accelerate scientific progress and make it easier for researchers to do their important work.

# Importance of Staying Current for Different Groups

Staying up-to-date with the latest research and developments is crucial for various groups, each with their own unique needs and motivations. Here, we discuss the importance of staying current for researchers, industry professionals, and journalists or science communicators.

Researchers, including professors, postdoctoral fellows, and graduate students, have a strong need to stay on top of recent literature in their respective fields. Professors and postdocs, especially those seeking tenure-track positions, must ensure their research is original and contributes to the advancement of their field. Graduate students, while often benefiting from the guidance of their supervisors, also need to stay informed about the latest developments to produce novel and impactful work. Regularly reviewing new publications allows researchers to identify gaps in knowledge, spark new ideas, and avoid duplicating efforts.

Industry professionals, particularly those in research and development (R&D) roles or working with cutting-edge technologies, must stay current to remain competitive and drive innovation within their organizations. By keeping abreast of the latest research, they can identify potential applications, anticipate future trends, and make informed decisions regarding product development and strategic planning. Staying up-to-date also enables industry professionals to collaborate effectively with academic researchers and incorporate state-of-the-art techniques into their work.

Journalists and science communicators play a vital role in bridging the gap between the scientific community and the general public. To accurately report on scientific breakthroughs and convey complex concepts to a broad audience, they must have a solid understanding of the latest research. Staying current allows journalists to identify newsworthy findings, provide context, and ensure their reporting is correct. Science communicators who stay informed can also help combat the spread of misinformation by presenting accurate, up-to-date information in an accessible manner.

# Conclusion

In this article, we explored the various strategies and tools researchers employ to stay up-to-date with the latest developments in their respective fields. By analyzing the responses from a diverse group of academics and professionals, we identified several key points that highlight the importance of having an efficient and sustainable process for staying informed.

Firstly, respondents emphasized the significance of regularly checking for new papers and publications, with frequencies ranging from daily to monthly. This underscores the need for researchers to allocate dedicated time to explore and digest new findings in their areas of expertise. Secondly, digital tools, such as Google Scholar, arXiv, and field-specific databases, emerged as a common theme, enabling researchers to streamline their literature searches and receive automated alerts for relevant content.

However, the survey also revealed challenges and limitations in the current processes. Many respondents desire more advanced filtering and recommendation systems that could help them identify the most pertinent papers based on their specific interests and research questions. Additionally, the time-consuming nature of thoroughly reading and understanding new publications was highlighted as a significant hurdle, emphasizing the need for more efficient methods of extracting key insights.

Developing a sustainable and efficient process for staying informed about recent developments is crucial for researchers to remain at the forefront of their fields. By adopting a combination of regular literature searches, targeted alerts, and collaborative knowledge-sharing within their networks, researchers can ensure they are well-equipped to contribute to the ongoing advancement of their disciplines.

Looking to the future, there is significant potential for developing more sophisticated tools and techniques to support researchers in their quest to stay up-to-date. Integrating artificial intelligence and machine learning algorithms could enable more accurate and personalized recommendations. Advanced natural language processing techniques could help summarize key findings and identify novel connections between disparate research areas. Furthermore, the growing trend towards open-access publishing and the democratization of knowledge through online platforms may help to break down barriers and facilitate more rapid dissemination of new discoveries.

In conclusion, staying on top of recent developments in one's field is an essential aspect of being a successful researcher. By continually refining their processes and embracing new technologies, researchers can ensure they remain at the cutting edge of their disciplines, driving innovation and contributing to the collective advancement of human knowledge.

# Data

Survey data is available [here.](https://docs.google.com/spreadsheets/d/1ZRc1z81nzhN63Z-AIamM1l7nBUfLTQuBuSHYduvHx78/edit?usp=sharing) Use it as you wish, just let me know.Introduction

Originally posted on: https://archeota.org/blog/posts/how-researchers-stay-current",0,2,1718218534,2024-06-12 18:55:34,https://www.reddit.com/r/academia/comments/1deef9z/how_researchers_stay_current_with_new_papers_and/,https://www.reddit.com/r/academia/comments/1deef9z/how_researchers_stay_current_with_new_papers_and/
ai literature review,1dijtfj,"📘 Free Workshop on June 28th — Using AI Ethically for Literature Review!
","Boost your literature review skills in this free workshop — ideal for students, researchers, professors, and academics.

**What you'll learn in this workshop?**

* **Research paper discovery:** Find relevant sources quickly.
* **Screening:** Assess relevance and quality.
* **Review:** Analyze and create a content matrix.
* **Write-Up:** Synthesize info into a cohesive review.
* **AI Integration:** Ethically enhance efficiency with AI \[Super-important topic\]

If you're interested, register here — https://lu.ma/wouemltw! ",0,0,1718691450,2024-06-18 06:17:30,https://www.reddit.com/r/academia/comments/1dijtfj/free_workshop_on_june_28th_using_ai_ethically_for/,https://www.reddit.com/r/academia/comments/1dijtfj/free_workshop_on_june_28th_using_ai_ethically_for/
ai literature review,1dy5nvm,AI summaries for literature review,"Doing a literature review right now, and I've been doing the ""AI, summarize this for me"" on ChatGPT when I want to quickly consume long form content like blogs, reports, papers, and books - is it just me or it kinda sucks? I've found that it can get disorganized quickly, and especially on longer content it tends to gloss over details. Sometimes it starts talking about concepts outside of the material's scope too.

Have you guys found AI useful this way? If so, how do you use it?",0,12,1720435010,2024-07-08 10:36:50,https://www.reddit.com/r/academia/comments/1dy5nvm/ai_summaries_for_literature_review/,https://www.reddit.com/r/academia/comments/1dy5nvm/ai_summaries_for_literature_review/
ai literature review,1e4t51q,AI tools to help with research literature review and citation from papers,Hi! I am looking for AI sources to help me with literature review in my research. Especially in finding citations/references from existing papers for specific topics. Any idea what to use?,1,1,1721147570,2024-07-16 16:32:50,https://www.reddit.com/r/academia/comments/1e4t51q/ai_tools_to_help_with_research_literature_review/,https://www.reddit.com/r/academia/comments/1e4t51q/ai_tools_to_help_with_research_literature_review/
ai literature review,1g998b4,Using AI for literature review,"AI seems to be changing everything rapidly and I'm having trouble keeping up. One of my students is about to submit their PhD thesis. It is very well written given that it is an ESL student. After attending a lecture by Elisabeth Bik I became suspicious about AI and used a common tool to analyse the literature review. 

80 percent of it resembled generative AI. The rest of the thesis is about 50 percent. There was almost no plagiarism. 

The student says that AI was used to ""polish"" the thesis, but I'm suspicious the software also chose the citations. Some of which seemed distant from the point being made in the thesis.

I'm rather upset because I have spent a lot of time supporting the student and reviewing chapters. I feel like I have just been reviewing output from a computer rather than a student. Now I'm reading that AI can be used to cover up the use of AI. 

For some validation, I ran the AI detection tool over two other literature reviews and they came out at 3 percent. 

I'm wondering how other academics and students feel about the increasing role of AI. Is this an ethnics violation or should I just let the thesis go out to the examiners?",0,8,1729569038,2024-10-22 03:50:38,https://www.reddit.com/r/academia/comments/1g998b4/using_ai_for_literature_review/,https://www.reddit.com/r/academia/comments/1g998b4/using_ai_for_literature_review/
ai literature review,1gnyc97,"Stay Ahead of the Curve with ALE’s Free ""AI Tools Boot Camp for Researchers: Core Essentials"" Course","As AI continues to reshape the academic landscape, staying one step ahead is essential. Join us for Academic Language Experts’ upcoming (free!) **AI Tools Boot Camp for Researchers: Core Essentials** course. 

This course offers practical, hands-on training with essential AI tools to streamline your literature review search, conduct research more efficiently write and edit your papers. 

Here’s what you can expect:

* **A focused, two-part (free!) course** covering core topics for researchers
* **Training on a curated selection of tools** designed specifically for academic needs
* **Lifetime access to session recordings** so you can revisit the material whenever needed
* **Guidance from Avi Staiman**, a world-renowned trainer in AI tools for academia

Whether you're a seasoned researcher or a new doctoral student, this boot camp will 

[Learn more about the featured tools and register today!](https://www.aclang.com/ai-bootcamp.php?src=reddit)",0,3,1731236823,2024-11-10 11:07:03,https://www.reddit.com/r/academia/comments/1gnyc97/stay_ahead_of_the_curve_with_ales_free_ai_tools/,https://www.reddit.com/r/academia/comments/1gnyc97/stay_ahead_of_the_curve_with_ales_free_ai_tools/
