query,id,title,selftext,score,num_comments,created_utc,created_date,url,permalink
ai literature review,je2esj,Looking for testers on a new tool that helps researchers discover and evaluate scientific articles,"We're looking to do user interviews in order to improve the user experience of scite.ai. If you'd be willing to be interviewed by 3 UX students about your literature review processes and then to walk through signing up and using scite, please message me or email us at [hi@scite.ai](mailto:hi@scite.ai)!",5,0,1603116945,2020-10-19 14:15:45,https://www.reddit.com/r/academia/comments/je2esj/looking_for_testers_on_a_new_tool_that_helps/,https://www.reddit.com/r/academia/comments/je2esj/looking_for_testers_on_a_new_tool_that_helps/
related works AI,xi23qo,Return to grad school for AI/engineering/Interdisciplinary PhD,"I'm looking at returning to grad-school after 20 years in industry as software-engineer. 

In 40s. MS from a top-20 public university in EE. 

Currently work in AI/ML software engineering at Google/Facebook/Apple.

I'm trying to find good interdisciplinary programs where I can ""sell"" my AI software experience. i found the industry experience very mundane and without much intellectual challenge, as industry works involves being mainly a coding machine in order to make money, which isn't very fulfilling. A goal would be to pursue some sort of academic position as a professor. ideally i'd like pursue studies related to applid-ai in how it affects society through some interdisciplinary program, but if that transition is not possible I'd at least like to return to an academic environment for PhD. My graduate gpa during MS is ~3.45, undergrad gpa from a prestigious university is 8/10. GRE ~ 168v/168q.

Question

- what ranking of engineering programs i can target? do i have any chance at top-5 engineering programs for PhD?

- is my gpa too low to be competitive? would age factor negatively and by how much?

- any interdisciplinary programs that may fit?

- how much an advantage if any is my current employment at a well known company?",6,8,1663562624,2022-09-19 04:43:44,https://www.reddit.com/r/academia/comments/xi23qo/return_to_grad_school_for/,https://www.reddit.com/r/academia/comments/xi23qo/return_to_grad_school_for/
ai literature review,13o3q5v,"Experiences with AI tools for scientific literature review, finding relevant papers, etc? (NOT chatGPT)","I've recently learned about several tools geared toward helping with literature review: Scite, Semantic scholar, Elicit, etc. I'm particularly interested in a tool that helps to find relevant papers. Lit review can take forever when you're looking for something specific. 

Have you tried any of these? Pros / cons, is one better than another? Are they reliable or any better than a basic Scholar search + hours scouring papers?",7,8,1684696847,2023-05-21 19:20:47,https://www.reddit.com/r/academia/comments/13o3q5v/experiences_with_ai_tools_for_scientific/,https://www.reddit.com/r/academia/comments/13o3q5v/experiences_with_ai_tools_for_scientific/
ai literature review,17s77ux,Is it okay to use AI (ChatGTP) to help write research papers?,"I’m an undergrad, working on a research project with a professor. Chad GTP help me write the code I used to analyze the data collected. 

And it’s also helped me write the paper, especially with the literature review. Of course I read through it to make sure it makes sense.

Would this be considered academic dishonesty, or am I using it properly as a tool?",1,13,1699632351,2023-11-10 16:05:51,https://www.reddit.com/r/academia/comments/17s77ux/is_it_okay_to_use_ai_chatgtp_to_help_write/,https://www.reddit.com/r/academia/comments/17s77ux/is_it_okay_to_use_ai_chatgtp_to_help_write/
ai literature review,18wos19,Accidental Unintended plagiarism because of missing out in literature review,"I frequently stumble upon a random thoughts on software engineering, obviously i try to check if this has been explored before , before writing a research paper  
I try in google scholar and ieee explore  
I believe sometimes i am not able to get my keywords correct in the search.  
I am scared that it may happen that i am unable to find 1 or more research papers who might have already stumbled upon my idea and/or research. I may plagiarise them by doing it again unknowingly or even fail to cite them even though they have already worked some of my research

Are there some tips and trick that i should know to prevent this?  
Any Ai tools that can help without infringing upon my maybe totally novel idea?  
Why don't authors first try to reach out to the author in such a case, so the author can pull out the paper?  
How to prevent this completely , since this is never acceptable?  
Are there any services to help with this?  
Any tips and suggestions?",1,3,1704200091,2024-01-02 12:54:51,https://www.reddit.com/r/academia/comments/18wos19/accidental_unintended_plagiarism_because_of/,https://www.reddit.com/r/academia/comments/18wos19/accidental_unintended_plagiarism_because_of/
llm literature review,18xzgpq,"What Harvard president did (copy words but still cited) vs faking data in nature science vs faking data in social science, which is worse?",My supervisor (in STEM) dose not think copying words without paraphrasing is too big a deal. He also supports accepts LLMs usage in academic publications: even the LLM wrote most of the literature review.,1,39,1704329165,2024-01-04 00:46:05,https://www.reddit.com/r/academia/comments/18xzgpq/what_harvard_president_did_copy_words_but_still/,https://www.reddit.com/r/academia/comments/18xzgpq/what_harvard_president_did_copy_words_but_still/
ai literature review,1978rmj,"With the new GPT store, I thought you would find this interesting :)","Hey everyone 👋🏻

I hope it is okay to post it here. I swear, I only do it because I believe the esteemed members of this community could benefit from this and find it useful (if not, I accept my faith of being deleted). 

I am currently interning at a start-up called EvidenceHunt, and I wanted to bring it to your attention.   
EvidenceHunt is basically an AI research assistant that you can have a conversation with. It is trained on and synced with Pubmed and NICE Guidelines (and other life sciences databases), so when it’s answering your questions, it summarises the relevant literature to your question/convo and references direct sources for you. Another part that could be useful for the researchers among us, is the AI-driven database search options and evidence extraction features, that literally scan the Pubmed for your specific (or not) keywords, and save you loads of time and effort in your review process. What I am trying to convey is that you can have a systematic literature review process on steroids.   
All of this is great, but why am I posting it now?   
Well, it is because I suspect some of you are ChatGPT Plus users, and I could not leave my desk today if I did not let you know we released a plug-in as well, that adds the research assistant element to your ChatGPT convo. In short - it is super quick at digging up and summarising research papers while linking the direct references, i.e. perfect for doing a quick and dirty biomedical and clinical research, but without the hassle.   
Oh, and it’s free!   
That’s it. If you find it interesting and think it could be helpful for you in any way, I did my part and am super happy.   


Here are the links:   
[EvidenceHunt Plugin for ChatGPT](https://chat.openai.com/g/g-DKfXXjVbe-evidencehunt)  
[EvidenceHunt Platform](https://evidencehunt.com/)

&#x200B;

https://i.redd.it/t4vtj0rqllcc1.gif",1,1,1705325421,2024-01-15 13:30:21,https://www.reddit.com/r/academia/comments/1978rmj/with_the_new_gpt_store_i_thought_you_would_find/,https://www.reddit.com/r/academia/comments/1978rmj/with_the_new_gpt_store_i_thought_you_would_find/
ai literature review,1avesm8,AI systems for Literature Reviews,"🚀 Exciting news! Our new survey paper about **#AI systems for literature reviews** is out. We dissect 32 groundbreaking tools and discuss the key challenges. #LLMs are changing the game!

Preprint 👉 https://arxiv.org/abs/2402.08565

The manuscript presents a comprehensive **review of the use of Artificial Intelligence (AI) in Systematic Literature Reviews (SLRs).** The increasing role of AI in this field shows great potential in providing more effective support for researchers, moving towards the semiautomatic creation of literature reviews. Our study focuses on how AI techniques are applied in the semi-automation of SLRs, specifically in the screening and extraction phases. We examine 21 leading SLR tools using a framework that combines 23 traditional features with 11 AI features. We also analyse 11 recent tools

that leverage large language models for searching the literature and assisting academic writing. Finally, **the paper discusses current trends in the field, outlines key research challenges, and suggests directions for future research.**

\#DataScience #MachineLearning #DeepLearning #AIprogress #Science #Research #ScienceForAll",1,3,1708425947,2024-02-20 10:45:47,https://www.reddit.com/r/academia/comments/1avesm8/ai_systems_for_literature_reviews/,https://www.reddit.com/r/academia/comments/1avesm8/ai_systems_for_literature_reviews/
ai literature review,1b7mncl,New paper mill discovered,"Just came across something really odd. Not sure where to post this so I'll just drop this here.

I recently published an article that just went online yesterday. The EIC e-mailed me out of the blue, informing me that someone tried to submit a letter, but he decided to reject it because it was too non-sensical. When I opened the file, the cover letter I saw nearly gave me an aneurysm:

“Professor editor Please have this letter corresponding on published article included into the future volume of the journal and waive for any charge. Corresponding author is from Laos and cannot pay for any charge. If there is any charge, please waive for it or please do not process/withdraw it if there is a charge.”

Yes, this was the whole cover letter. A pretty obvious red flag when the cover letter does not mention anything about the topic of the submission, especially considering that the journal is 100% free to publish in (there isn't even a paid open access option available).

When I was scrolling around on the PDF, I got bored and decided to see what the authors of this letter has published in the past. I clicked into the ORCID profile of the author named Viroj Wiwanitkit, who is supposedly from the “University Centre for Research & Development Department of Pharmaceutical Sciences, Chandigarh University, Mohali, Punjab, India”: [https://orcid.org/0000-0003-1039-3728](https://orcid.org/0000-0003-1039-3728)

What I saw was 1,500 ORCID (!!!! not a typo) entries. Now I didn’t have time to go through all of them, but I am 90% certain that at least the first 20 ORCID pages out of the 32 pages of publications (that's about 1000 entries) is a letter to the editor, commenting on a previously published article. These letters all follow a specific format, either giving a very generic take on the topic discussed, or listing some obvious limitations of the study that is being commented on; limitations that often are already discussed by the authors. It’s always the same one or two co-authors. And there is always a citation to a previous letter that they published which I presume helps to bump up their H-index or citation count. I would not be surprised if these were all drafted using some sort of AI tools.

This person’s ORCID page showed that over 60 letters to the editors were published over the past 2 months alone (in 2024). That is 1 letter per day. Some of the journals that published these letters are also very legit journals, like Journal of Pediatric Surgery and Journal of Palliative Medicine. I cannot wrap my head around this; my personal record is drafting one letter over 3 days. When we draft letters, they usually need to go through multiple rounds of internal review by coauthors and will take even longer if we need to replicate the original authors’ analyses, not to mention the time that it will take to undergo an editorial review and the journal production process.

I can’t help but wonder what the authors are getting out of this, how many other people are doing this, and why journals are not taking notice of these poor quality letters making their way into the literature especially considering how many red flags there are.",48,10,1709687800,2024-03-06 01:16:40,https://www.reddit.com/r/academia/comments/1b7mncl/new_paper_mill_discovered/,https://www.reddit.com/r/academia/comments/1b7mncl/new_paper_mill_discovered/
related works AI,1c1dsol,How much do tools help you in being a prolific academic?,"Sometimes, I notice many ""academic influencers"" advocating certain tools, often the latest AI tool claiming to revolutionize everything from proposals to literature reviews.

Anecdotally, the most prolific researchers I know do not use any of these new tools. Instead, they adhere to established processes with diligence and discipline.

I understand that some of them are very useful, like LaTeX editors, Reference Managers, and scholarly search engines with inferences to related works.

But I would like to hear the thoughts of other academics. Do you think that tools play a big role in being a prolific academic, and are there tools you wouldn't live without?",20,25,1712838477,2024-04-11 12:27:57,https://www.reddit.com/r/academia/comments/1c1dsol/how_much_do_tools_help_you_in_being_a_prolific/,https://www.reddit.com/r/academia/comments/1c1dsol/how_much_do_tools_help_you_in_being_a_prolific/
ai literature review,1c3ooqu,Literature review using AI,"My last literature review was in the dark ages, pre AI. 

I’m just discovering AI tools like Research Rabbit, Elicit, Concensus, Perplexity etc. Yet to try them though so haven’t found their pros/ cons. 

My question:
when publishing a literature/ scoping review etc… in ‘the good old days’ you would detail in the methods section your search strategy, databases searched, keywords etc. 

How does this change for journal submission if you’ve used a tool like Research Rabbit? Has anyone actually done this or can print me to an example of what it looks like?
Thanks!",3,4,1713083276,2024-04-14 08:27:56,https://www.reddit.com/r/academia/comments/1c3ooqu/literature_review_using_ai/,https://www.reddit.com/r/academia/comments/1c3ooqu/literature_review_using_ai/
