query,id,title,selftext,score,num_comments,created_utc,created_date,url,permalink
ai literature review,1h0i728,Recommendations for AI tools to conduct a systematic review?,"Hi everyone! 👋

I’m planning to conduct a systematic review as part of my academic research. My focus is on exploring a timely and recent topic: the addictive potential of short-form videos (like those on TikTok, Instagram Reels, etc.).

I’d love to hear your recommendations for AI-powered tools that can help streamline the following tasks:

Advanced literature search: Identifying relevant articles and studies in academic databases.

Data extraction: Summarizing key information from multiple documents.

Visualization: Creating graphs, concept maps, or citation network diagrams.

Any other tools that might be helpful for this type of project.

Additionally, I’d appreciate any general advice on integrating AI into the research process or hearing about personal experiences from others who’ve used AI for systematic reviews.

Thanks in advance for your help! 🙏",0,7,1732644031,2024-11-26 18:00:31,https://www.reddit.com/r/academia/comments/1h0i728/recommendations_for_ai_tools_to_conduct_a/,https://www.reddit.com/r/academia/comments/1h0i728/recommendations_for_ai_tools_to_conduct_a/
ai literature review,1i30t6e,Introduction to the use of AI in literature search,"Here is a list of sources that serve as an introduction to the use of AI in literature search and helps to find real references:

**Consensus**: Identify, analyze, and summarize research. Free/premium. 🌐 WWW: [https://consensus.app/](https://consensus.app/) 🌐 ChatGPT model: [https://chatgpt.com/g/g-bo0FiWLY7-consensus](https://chatgpt.com/g/g-bo0FiWLY7-consensus)

**ScholarAI**: Search and review scientific papers. Free/premium. 🌐 WWW: [https://scholarai.io/](https://scholarai.io/) 🌐 ChatGPT model:   
[https://chatgpt.com/g/g-L2HknCZTC-scholar-ai](https://chatgpt.com/g/g-L2HknCZTC-scholar-ai)

**SciSpace**: Identify and summarize literature for reviews and answer questions in PDFs. Free / premium. 🌐 [https://typeset.io](https://typeset.io) 🌐 ChatGPT model: [https://chatgpt.com/g/g-NgAcklHd8-scispace](https://chatgpt.com/g/g-NgAcklHd8-scispace)

**Elicit**: Helps formulate research questions and search for relevant literature, etc. Free. 🌐 [https://elicit.org](https://elicit.org)

**Semantic Scholar**: AI-powered search engine to summarize articles and identify citations. It powers the above tools. Free. 🌐 [https://www.semanticscholar.org/](https://www.semanticscholar.org/)

**Xplorer**: Discover, read, reference, and search through all arXiv papers. Free. 🌐 [https://chatgpt.com/g/g-WeT9tE7SR-xplorer](https://chatgpt.com/g/g-WeT9tE7SR-xplorer)

**R Discovery**: Presents answers validated from 250M+ scientific, academic, and medical research papers. Free / premium. 🌐 [https://discovery.researcher.life/](https://discovery.researcher.life/) 🌐 ChatGPT model: [https://chatgpt.com/g/g-dPDyRhWYG-ask-r-discovery](https://chatgpt.com/g/g-dPDyRhWYG-ask-r-discovery)

**Scopus AI**: Elsevier's tool to search papers since 2003. Paid. (Scopus subscription). 🌐 [https://www.scopus.com/search/form.uri#basic](https://www.scopus.com/search/form.uri#basic)

**Research Assistant:** Clarivates's AI tool for browsing Web of Science. Paid. (WoS subscription). 🌐 [https://www.webofscience.com/wos/woscc/basic-search](https://www.webofscience.com/wos/woscc/basic-search)",0,1,1737065399,2025-01-16 22:09:59,https://www.reddit.com/r/academia/comments/1i30t6e/introduction_to_the_use_of_ai_in_literature_search/,https://www.reddit.com/r/academia/comments/1i30t6e/introduction_to_the_use_of_ai_in_literature_search/
ai literature review,1i32fe0,HELP!? Literature Review with no prior knowledge ,"I need guidance.

I'm taking a 4th year undergrad taking a directed research course in the social sciences and the professor wants me to create a literature review for his upcoming paper (the other student was assigned to analyse the data). 

I've never done a literature review, and I have no prior knowledge on the topic of research (AI cheating in education and pedagogical methods to avoid it.)

This is a very cool opportunity but my other classes are already a little reading heavy for me, and I've got other stuff going on.

How much time do you think it'll take to learn everything and produce a decent literature review?

Do you have any tips for this situation.",0,4,1737069787,2025-01-16 23:23:07,https://www.reddit.com/r/academia/comments/1i32fe0/help_literature_review_with_no_prior_knowledge/,https://www.reddit.com/r/academia/comments/1i32fe0/help_literature_review_with_no_prior_knowledge/
ai literature review,1ibknbq,How to comeup with research idea in AI ( for my MSc ),"I am currently following AI master program and I’m bit struggling to find a topic for my research. For my bachelor’s I have done IT degree and thats how I got interested in AI. Also I have done a literature review on AGI and I was really into that.

Fast forward to today I got into this AI program, which mainly focuses on core AI subjects like Deep Learning, Agent technologies, Knowledge graphs etc. Also they deliver content in two forms one focuses on theoretical, conceptual side of the subject and other focuses more on coding and development of AI related applications. Anyway I really like this program since it more focuses on AI aspect rather than data science subjects.

As I said previously my first research interest in creating human level artificial intelligence, at least work toward generalized learning algorithms which over time adapt to any kind of task. But I know this is a huge target and I don’t know how should I contribute. I reached to multiple lecturers but I didn’t get any satisfactory feedback regarding where should I start.

Next I am interested in AI in education, basically leveraging AI for optimal learning experience. I really interested in this also I believe in life long learning and every one should have tools to learn anything depend on how they learn things and their speed. At the moment I try to find some topic using ChatGPT but couldn’t fond anything I like.

Also I am a software engineer and uses LLMs to speed up development process. If both above topics (AGI and AI with education) then I thought to settle with something in AI and Software development field. 

My final question is where should I start? And which area I should focus. How to find a topic that has a worth for community?",0,3,1738013335,2025-01-27 21:28:55,https://studyguide.jyu.fi/2024/en/degreeprogram/ainmp2024/,https://www.reddit.com/r/academia/comments/1ibknbq/how_to_comeup_with_research_idea_in_ai_for_my_msc/
ai literature review,1ix8dw9,AI tools to help literature review during thesis,"Hi guys,
Im doing some literature review on a certain topic and I want to know if there is any reliable AI tool that can read a file of, for example, bibtex entries and select papers from that file according to the inputs I give it.

Ex:

File containing 10 bibtex references.
""Read all 10 articles present in the file X and select the ones that mention in detail how to cut strawberries. Explain your reasoning.""

I have tries the classics ChatGPT and Deepseek, and although the latter is better, I have noticed that it doesn't report the same papers every time.

Any suggestions? ",0,8,1740420003,2025-02-24 18:00:03,https://www.reddit.com/r/academia/comments/1ix8dw9/ai_tools_to_help_literature_review_during_thesis/,https://www.reddit.com/r/academia/comments/1ix8dw9/ai_tools_to_help_literature_review_during_thesis/
ai literature review,1iyt2qw,Science journalist interested in speaking with grad students/postdocs about the AI-based tools they find helpful in streamlining the research process,"Hello All,

It's nice to (virtually) meet you. I am a freelance [science journalist](https://www.amandaheidt.com/), and I'm currently on assignment for [*Nature*](https://www.nature.com/) to write a 2000-word piece on AI tools for academics that help streamline the research process, including data collation, experimental planning, literature review, writing, referencing and statistical analysis.

I'm looking to speak specifically with graduate students (MS/PhD) and postdocs about their experiences with different platforms. The ones on my list so far include OpenAI, DeepSeek and DeepResearch, Semantic Scholar, Scholarcy, Zotero, Research Rabbit, Wolfram Alpha, SciSpace, and Coral AI. I know there are more and more of these all the time, though, and I'm interested in other examples as well so long as they have a direct application to scientific research.

Please DM me if you're interested in speaking. My deadline is March 10, so I'd need to wrap up my reporting by March 7.",0,0,1740591136,2025-02-26 17:32:16,https://www.reddit.com/r/academia/comments/1iyt2qw/science_journalist_interested_in_speaking_with/,https://www.reddit.com/r/academia/comments/1iyt2qw/science_journalist_interested_in_speaking_with/
lit review ai,1ji3ysi,Submitting a Writing Sample,"i am applying to a lab which is study AI mediated communication, and intending to submit a writing sample. i have two choices 
1. My actual thesis proposal, solid and good, but not directly related to the topic (media and cognition, broadly speaking)
2. I have another lit review on AI and perception. There is proposed method in here, and I have a few days to edit/work, but regardless, this too is relatively good-ish. 

If pages matter, the prior is about 100+ and the latter is 40ish. But imo, prior has better quality and more work done on it. 

It seems silly to ask given the AI one is a match, however, what do you think, which writing sample should I submit? ",1,1,1742749306,2025-03-23 17:01:46,https://www.reddit.com/r/academia/comments/1ji3ysi/submitting_a_writing_sample/,https://www.reddit.com/r/academia/comments/1ji3ysi/submitting_a_writing_sample/
ai literature review,1kiaqeu,Using Ai for literature review at a PhD level,"I am a PhD candidate and I’ve struggled with reading and umderstanding academic literature especially when the paper is dense and technical. So I started using an AI tool to summarizing information from the papers I provide and it's very accurate.

My approach is simple, I read the abstract of a paper, and if it's relevant to my research, I ask the AI for a breakdown of the paper’s objectives, methodology, results and important aspects in a discussion in a clear and understandable manner This has helped me to go through literature quicker and understand but I am concerned whether this will affect me or if I should not go through literature in such a way.",0,8,1746767693,2025-05-09 05:14:53,https://www.reddit.com/r/academia/comments/1kiaqeu/using_ai_for_literature_review_at_a_phd_level/,https://www.reddit.com/r/academia/comments/1kiaqeu/using_ai_for_literature_review_at_a_phd_level/
ai literature review,1klk4b8,Comparing ChatDOC and NotebookLM for validation testing in academic research.,"I’ve been working on a pretty methodology-heavy research project and figured I’d share some thoughts on using AI tools for source validation. I tested both ChatDOC and NotebookLM, especially for literature review and verifying claims in technical papers. TL;DR: both are useful, but they serve slightly different purposes depending on what stage you're in.

My workflow context:
I'm in grad school (social sciences, but with quant overlap), and I often deal with long PDFs, peer-reviewed articles, datasets with codebooks, working papers, and methodological appendices. One of my biggest challenges is verifying whether a paper really makes a claim or reports certain limitations - not just summarizing, but seeing where in the text it happens and how it's phrased.

NotebookLM

It’s great for synthesizing ideas. It’s great for exploratory work and helping me make connections when I’m just starting to think about a topic. It’s great for organizing ideas across papers and summarizing key concepts. It’s nice to be able to upload multiple documents and ask cross-reference questions.
But its biggest drawback is that it doesn’t show the exact original text. You often get documents that have been parsed by them, and those tables or original layouts that were in the document you uploaded are gone, just a mess of text, which means I end up having to go back and double-check the document. This is fine when I’m brainstorming, but not so convenient when I need to double-check the author’s exact wording or locate a specific data point.

ChatDOC

It feels more solid when you need accuracy. Best of all, it pulls the exact sentence or paragraph from the document and shows where it came from. Great for quick checks like:
- “What confidence intervals did they use?”
- “Where do they mention sampling bias?”
- “Does the paper discuss any limitations?”
You can ask these kinds of questions and it will provide the answer as well as the source text, and you can ask questions directly in the document. This is great for writing a literature review where you need to cite specific phrases. NotebookLM does support citations, but as I mentioned earlier, it only provides a large paragraph of text, not specific sentences.
Also, it handles follow-up questions in a fairly natural way without straying off topic. I usually start with some general questions (“Are there any limitations mentioned?”) and then follow up with more detailed content (“Where is the methods section?”), which keeps the context nicely.
One drawback I’ve noticed is that when importing content directly from website links, the formatting doesn’t always come through cleanly. Sometimes things get a bit jumbled, which can make it hard to read.

Final thoughts
I use both tools now, but for different things:
- NotebookLM: better for general understanding and early-stage synthesis
- ChatDOC: better for precision and validation, pulling actual quotes and finding the right section fast
If you’re at the point in your research where accuracy matters (especially for lit reviews or when you’re writing up methods sections), ChatDOC’s been more helpful in my experience.
Curious if anyone else is combining tools or using other document-specific AI tools (e.g., ScholarAI, Semantic Scholar, etc.) in their workflow? Would love to hear how others are doing it.
",20,2,1747137700,2025-05-13 12:01:40,https://www.reddit.com/r/academia/comments/1klk4b8/comparing_chatdoc_and_notebooklm_for_validation/,https://www.reddit.com/r/academia/comments/1klk4b8/comparing_chatdoc_and_notebooklm_for_validation/
ai literature review,1kn2ns7,Has anyone here used AI tools to help with literature review?,[removed],1,0,1747295747,2025-05-15 07:55:47,https://www.reddit.com/r/academia/comments/1kn2ns7/has_anyone_here_used_ai_tools_to_help_with/,https://www.reddit.com/r/academia/comments/1kn2ns7/has_anyone_here_used_ai_tools_to_help_with/
ai literature review,1kqyda1,Can you write your PHD thesis ONLY By Using AI - My Experience,"I teach entrepreneurship and innovation, and my research requires me to stay up to date with emerging technologies and how they impact our lives. Naturally, I'm an avid AI user. I design workflows and delegate routine tasks in both my teaching and research to AI tools.

This led me to a provocative question:
“What if someone tried to write their entire PhD thesis using AI?”

Now, I fully acknowledge the ethical and legal concerns here.
Disclaimer: I do not condone or support writing a PhD thesis entirely with AI. However, I understand why someone might be tempted to do it. I’m not affiliated with or sponsored by any tools mentioned below. If you choose to use them, please do so responsibly and ethically.

That said, here’s the experimental workflow I designed (most tools have free tiers, but to get decent results you usually need to pay for credits):

Use ChatGPT’s deep research features to identify research gaps.
Validate the research question with Consensus AI.
Use Elicit to gather at least 50 relevant papers.
Upload the papers to ThesisAI to generate a literature review and introduction.
Feed that into Genspark AI to prepare a thesis traction board presentation.
Present to your thesis board and obtain ethics committee approval.
Conduct and record interviews.
Use Transgate AI to transcribe them.
Upload transcripts and prompt Manus AI with your research questions to analyze interview results.
Use ChatGPT to write the conclusion section.
Compile the thesis by combining findings and conclusions.
Use Gamma App to create your thesis defense presentation and rehearse.
Present to the thesis committee.
Sounds legit, right?

Well, it didn’t work.

The entire plan fell apart at Step 4. The literature review and introduction generated by ThesisAI were a total mess. The topic was in my area of expertise, but even I struggled to assess whether the research question truly added any value. I wasted a lot of precious time.

Some AI tools genuinely help accelerate your process, but at the PhD level, you need deep understanding. From my experience, AI can’t give you that. In fact, it can even reduce your opportunities to learn and grasp the subject properly.

My advice:
There’s a big difference between doing something with AI and letting AI do it for you. Use AI to support your work, but make sure you understand what you’re doing. Otherwise, you’re no better than a savvy 15-year-old playing with prompts—and you bring little to no value to the table.
",0,1,1747723623,2025-05-20 06:47:03,https://www.reddit.com/r/academia/comments/1kqyda1/can_you_write_your_phd_thesis_only_by_using_ai_my/,https://www.reddit.com/r/academia/comments/1kqyda1/can_you_write_your_phd_thesis_only_by_using_ai_my/
ai literature review,1ldqmf8,Feeling like an impostor (rant/vent),"So i wrote my term paper and let's just say it's the most garbage atrocity humanity has ever seen. And I'm not having an impostor syndrome or whatever, I've read through others work and mine reads worse that any slop AI could ever muster. Maybe I'd feel a bit better about it if I'd had any results, but i didn't finish the experiment on time so i only have literature review and methodology. My professor  said that he is dissapointed, that i didn't finish,but that i still might ""silde through"" with what i have, that it's not that serious, but it literally is that serious. It's gonna be uploaded into the system forever attached to my name and looking back at the notes he gave me i think he never even read it. Genuinely it is so embarassing, i have to present it in 2 days, i can't edit it anymore and while making the slides (that I'm stuck on for hours even though it should take like 40 minutes) it just hit me how much of an impostor i am. I know they won't throw me out of uni, they probably won't even read through it either, but i really wish they would throw me out, because i just don't fit in. I'm stupid as a brick, I've been brainrotted so much I'm struggling to write in my native language and i don't have the charisma to pull off something so half assed. This degree is literally paid by the goverment  and I don't deserve it. I just don't understand what is the point of letting people like me ""slide through""? ",0,3,1750175263,2025-06-17 15:47:43,https://www.reddit.com/r/academia/comments/1ldqmf8/feeling_like_an_impostor_rantvent/,https://www.reddit.com/r/academia/comments/1ldqmf8/feeling_like_an_impostor_rantvent/
ai literature review,1ldrbtc,Comparing NotebookLM and ChatDOC for academic research Workflows,"There are two tools that I’ve used extensively for academic research - NotebookLM and ChatDOC - and while they share a few similarities on the surface (both allow you to upload documents and ask questions), they’ve ended up serving quite different purposes in my workflow.



NotebookLM really stands out when you’re working with multiple sources and need to build an understanding across them. I found it especially helpful during the early stages of a literature review, where you're trying to trace how different papers approach the same problem. It provides source-grounded responses, and every claim it makes is linked back to the original document. This citation-style linking has been useful when pulling together outlines or note, you can track where each statement came from without second-guessing.



When it comes to working directly with PDFs—especially complex, academic ones—\*\*ChatDOC\*\* has been more reliable. I read a lot of journal articles, technical reports, and white papers with multi-column layouts, embedded tables, and figures. With NotebookLM, that formatting often breaks or gets flattened in the upload process, which can make it hard to interpret data-heavy sections. ChatDOC, on the other hand, tends to preserve the document structure more faithfully. It recognizes tables well, keeps the multi-cell formatting intact, and displays both the AI response and the original PDF side by side, which makes it easier to verify things quickly. That side-by-side layout sounds minor, but in practice, it makes a huge difference when you’re trying to interpret a chart or double-check how a statistic was worded.



Neither tool is perfect. NotebookLM sometimes struggles with inconsistent terminology between documents, and ChatDOC occasionally misreads footnotes or complex math notation. But I’ve found that using them in tandem, NotebookLM for synthesis, ChatDOC for precision, covers a lot of ground that traditional methods didn’t. Now I tend to use NotebookLM for big-picture comparisons and ChatDOC when I’m focusing on one paper and need to understand its logic, structure, or data in detail.



Open to other tools that combine solid citation tracking with strong layout fidelity, or even an open-source option that handles both well.

",4,3,1750176867,2025-06-17 16:14:27,https://www.reddit.com/r/academia/comments/1ldrbtc/comparing_notebooklm_and_chatdoc_for_academic/,https://www.reddit.com/r/academia/comments/1ldrbtc/comparing_notebooklm_and_chatdoc_for_academic/
ai literature review,1lpi9cv,Anyone else drowning in literature reviews? I built an AI tool that cuts days down to minutes. Seeking beta testers.,"Hey r/PhD,

I've been working on a project because I was personally so frustrated with how much time I spent just sifting through papers, summarizing, and then trying to pull it all together into a presentation or a literature review draft. It felt like weeks just vanished for a single research piece.

So, I built **Reviewer AI**. It's an AI-powered tool designed to automate that tedious part. You input your topic, and it can help find, filter, summarize relevant articles, and even generate a first draft of your literature review or a full presentation in minutes.

I'm currently looking for a few researchers (PhD students, postdocs, academics) to try it out for free and give me feedback. If this sounds like something that could save you dozens of hours, check it out and sign up for early access here:

[https://reviewerai-ext.carrd.co/](https://reviewerai-ext.carrd.co/)

Let me know your thoughts or if you've faced similar frustrations.

Cheers,",0,5,1751416633,2025-07-02 00:37:13,https://www.reddit.com/r/academia/comments/1lpi9cv/anyone_else_drowning_in_literature_reviews_i/,https://www.reddit.com/r/academia/comments/1lpi9cv/anyone_else_drowning_in_literature_reviews_i/
ai literature review,1m6em2x,"which paid AI do you prefer to write your thesis: ChatGPT, Gemini, or Claude?","hello everyone,   
in writing your research or your literature review, which AI do you prefer:  ChatGPT, Gemini, or Claude?

(note that I'll go for the paid version of one) ",0,8,1753192193,2025-07-22 13:49:53,https://www.reddit.com/r/academia/comments/1m6em2x/which_paid_ai_do_you_prefer_to_write_your_thesis/,https://www.reddit.com/r/academia/comments/1m6em2x/which_paid_ai_do_you_prefer_to_write_your_thesis/
